[
    {
        "Hamza_Mounir_CV.pdf": {
            "emails": [
                "7amzahamza8@gmail.com"
            ],
            "phones": [
                "0127006792"
            ],
            "linkedin": [
                "linkedin.com/in/hamza"
            ],
            "github": [
                "github.com/7amzahamza8"
            ],
            "education": [],
            "certifications": [
                "Certification"
            ],
            "technical_skills": [],
            "projects": [
                [
                    "Projects",
                    "Native (Mother Tongue) English: Basic proficiency "
                ]
            ],
            "summary": "```JSON\n{\n  \"personal_information\": {\n    \"name\": \"Hamza Mohammed Mounir El -Marghany\",\n    \"phone\": \"01270067920\",\n    \"email\": \"7amzahamza8@gmail.com\",\n    \"linkedin\": \"www.linkedin.com/in/hamza -mounir -359800342\",\n    \"github\": \"https://github.com/7amzahamza8/java_project_6\"\n  },\n  \"professional_summary\": {\n    \"motivation\": \"Motivated and fast learner\",\n    \"skills\": [\n      \"business analysis\",\n      \"Flutter development\",\n      \"Oracle SQL\"\n    ],\n    \"passion\": \"Passionate about technology and software development\",\n    \"experience\": \"Hands -on experience in Flutter, Java, and Oracle projects\"\n  },\n  \"education\": {\n    \"institution\": \"NTG School\",\n    \"level\": \"Secondary Level (2nd Secondary)\",\n    \"expected_graduation_year\": \"2026\"\n  },\n  \"certifications_and_courses\": [\n    \"Fundamental Oracle Courses\",\n    \"Fundamental MyS QL Courses\",\n    \"Flutter Development Course\",\n    \"Java Programming Course\",\n    \"C++ Programming Course\"\n  ],\n  \"technical_skills\": {\n    \"programming_languages\": [\n      \"Flutter\",\n      \"Java\"\n    ],\n    \"database_management\": [\n      \"Oracle SQL\"\n    ],\n    \"soft_skills\": [\n      \"Fast Learner\",\n      \"Analytical Thinking\",\n      \"Problem Solvi ng\"\n    ]\n  },\n  \"projects\": {\n    \"flutter\": \"Developed multiple Flutter projects, showcasing UI/UX design and app functionality\",\n    \"java\": \"Built Java applications to solve programming challenges and simulate real -world systems\",\n    \"oracle_sql\": \"Created and managed Oracle SQL projects, including database design and query optimization\"\n  },\n  \"languages\": {\n    \"arabic\": \"Native (Mother Tongue)\",\n    \"english\": \"Basic proficiency\"\n  },\n  \"additional_information\": {\n    \"work_experience\": \"No prior work experience; eager to gain hands -on professional exposure\",\n    \"commitment\": \"Committed to continuous learning and skill development\",\n    \"references\": \"References available upon request\"\n  }\n}\n```"
        }
    },
    {
        "John_Doe_CV.docx": {
            "emails": [
                "johndoe@email.com"
            ],
            "phones": [
                "234-567-8901"
            ],
            "linkedin": [
                "linkedin.com/in/johndoe"
            ],
            "github": [
                "github.com/johndoe"
            ],
            "education": [
                "Master",
                "Graduated",
                "Bachelor",
                "Graduated"
            ],
            "certifications": [
                "Engineer",
                "Certification"
            ],
            "technical_skills": [],
            "projects": [],
            "summary": "```JSON\n{\n  \"basics\": {\n    \"name\": \"John Doe\",\n    \"email\": \"johndoe@email.com\",\n    \"phone\": \"+1 234-567-8901\",\n    \"linkedin\": \"linkedin.com/in/johndoe\",\n    \"github\": \"github.com/johndoe\",\n    \"summary\": \"Highly skilled software engineer with 5+ years of experience in developing scalable applications and solutions in the field of AI, cloud computing, and enterprise software. Proficient in working with cutting-edge technologies and committed to delivering high-quality products. Passionate about innovation and solving complex problems to contribute to IBM's vision of shaping the future of technology.\"\n  },\n  \"experience\": [\n    {\n      \"title\": \"Software Engineer\",\n      \"company\": \"XYZ Technologies\",\n      \"location\": \"San Francisco, CA\",\n      \"startDate\": \"June 2020\",\n      \"endDate\": \"Present\",\n      \"highlights\": [\n        \"Developed cloud-based applications using IBM Cloud and Kubernetes, improving deployment efficiency by 40%.\",\n        \"Implemented machine learning algorithms for data analysis and predictive analytics, increasing project accuracy by 25%.\",\n        \"Led a team of 4 engineers to create a customer-facing SaaS platform, which was successfully launched and now has over 100,000 users.\",\n        \"Collaborated with cross-functional teams to ensure smooth integration of software solutions into enterprise-level systems.\",\n        \"Maintained high-quality code by implementing unit tests and conducting peer code reviews.\"\n      ]\n    },\n    {\n      \"title\": \"Junior Software Developer\",\n      \"company\": \"Tech Solutions Inc.\",\n      \"location\": \"San Jose, CA\",\n      \"startDate\": \"May 2017\",\n      \"endDate\": \"May 2020\",\n      \"highlights\": [\n        \"Worked with a team to design and implement RESTful APIs for e-commerce platforms, reducing latency by 20%.\",\n        \"Utilized IBM Watson to integrate natural language processing capabilities into customer service applications.\",\n        \"Assisted in the development of a cloud-based inventory management system, which decreased downtime by 15%.\",\n        \"Actively participated in sprint planning, daily standups, and retrospectives as part of an Agile development team.\"\n      ]\n    }\n  ],\n  \"education\": [\n    {\n      \"degree\": \"Master of Science in Computer Science\",\n      \"institution\": \"University of California, Berkeley\",\n      \"graduationDate\": \"2017\",\n      \"focus\": \"AI, machine learning, and cloud computing\",\n      \"thesis\": \"'Optimizing Distributed Systems for Cloud Computing Environments.'\"\n    },\n    {\n      \"degree\": \"Bachelor of Science in Information Technology\",\n      \"institution\": \"University of Texas, Austin\",\n      \"graduationDate\": \"2015\",\n      \"specialization\": \"database management, software engineering, and network security\"\n    }\n  ],\n  \"skills\": {\n    \"programmingLanguages\": [\n      \"Java\",\n      \"Python\",\n      \"C++\",\n      \"JavaScript\"\n    ],\n    \"cloudTechnologies\": [\n      \"IBM Cloud\",\n      \"AWS\",\n      \"Azure\"\n    ],\n    \"aiMl\": [\n      \"TensorFlow\",\n      \"PyTorch\",\n      \"IBM Watson\"\n    ],\n    \"databaseManagement\": [\n      \"SQL\",\n      \"NoSQL (MongoDB, Cassandra)\"\n    ],\n    \"devops\": [\n      \"Kubernetes\",\n      \"Docker\",\n      \"Jenkins\",\n      \"CI/CD\"\n    ],\n    \"frameworksTools\": [\n      \"Spring Boot\",\n      \"React\",\n      \"Angular\",\n      \"Node.js\"\n    ],\n    \"versionControl\": [\n      \"Git\",\n      \"GitHub\",\n      \"GitLab\"\n    ],\n    \"methodologies\": [\n      \"Agile\",\n      \"Scrum\",\n      \"Test-Driven Development (TDD)\"\n    ],\n    \"operatingSystems\": [\n      \"Linux\",\n      \"Windows\",\n      \"macOS\"\n    ],\n    \"softSkills\": [\n      \"Problem-solving\",\n      \"team leadership\",\n      \"effective communication\",\n      \"time management\"\n    ]\n  },\n  \"certifications\": [\n    \"IBM Certified Solution Architect – Cloud Solutions\",\n    \"AWS Certified Solutions Architect – Associate\",\n    \"Google Cloud Professional Machine Learning Engineer\"\n  ],\n  \"projects\": [\n    {\n      \"title\": \"AI Chatbot for Customer Service\",\n      \"description\": \"Developed an AI-powered chatbot using IBM Watson to handle customer queries and reduce call center traffic by 30%.\"\n    },\n    {\n      \"title\": \"Cloud-Based Inventory Management System\",\n      \"description\": \"Built a cloud-based inventory management solution, providing real-time updates and reducing order processing time by 25%.\"\n    }\n  ]\n}\n```"
        }
    },
    {
        "s.txt": {
            "emails": [
                "john.doe@example.com"
            ],
            "phones": [
                "(123) 456-7890"
            ],
            "linkedin": [
                "linkedin.com/in/johndoe"
            ],
            "github": [
                "github.com/johndoe"
            ],
            "education": [
                "Master",
                "University",
                "Bachelor",
                "University"
            ],
            "certifications": [
                "Engineer",
                "Certification"
            ],
            "technical_skills": [],
            "projects": [
                [
                    "Projects",
                    "Developed a machine learning model to analyze and extract key data from resumes. Cloud"
                ]
            ],
            "summary": "```json\n{\n  \"Personal Information\": {\n    \"Name\": \"John Doe\",\n    \"Email\": \"john.doe@example.com\",\n    \"Phone\": \"(123) 456-7890\",\n    \"LinkedIn\": \"linkedin.com/in/johndoe\",\n    \"GitHub\": \"github.com/johndoe\"\n  },\n  \"Professional Summary\": {\n    \"Experience\": \"Experienced software engineer\",\n    \"Expertise\": [\"cloud computing\", \"AI\", \"machine learning\"],\n    \"Passion\": \"building scalable and efficient systems for enterprise applications\"\n  },\n  \"Skills\": {\n    \"Programming Languages\": [\"Python\", \"Java\", \"C++\"],\n    \"Cloud Technologies\": [\"AWS\", \"Azure\", \"Google Cloud\"],\n    \"AI & Machine Learning\": [\"TensorFlow\", \"PyTorch\", \"Keras\"],\n    \"Tools\": [\"Docker\", \"Kubernetes\", \"Jenkins\"]\n  },\n  \"Education\": {\n    \"Master of Science in Computer Science\": {\n      \"University\": \"University of Technology\",\n      \"Year\": 2015\n    },\n    \"Bachelor of Science in Software Engineering\": {\n      \"University\": \"University of Technology\",\n      \"Year\": 2013\n    }\n  },\n  \"Certifications\": [\"Certified Kubernetes Administrator (CKA)\", \"AWS Certified Solutions Architect\"],\n  \"Projects\": {\n    \"AI-Based Document Analyzer\": {\n      \"Description\": \"Developed a machine learning model to analyze and extract key data from resumes\"\n    },\n    \"Cloud-Based File Storage System\": {\n      \"Description\": \"Designed and implemented a scalable cloud storage solution using AWS S3\"\n    }\n  },\n  \"Languages\": {\n    \"English\": \"Fluent\",\n    \"Spanish\": \"Intermediate\"\n  }\n}\n```"
        }
    }
]